{
  "$schema": "./schemas/knowledge-document.schema.json",
  "schemaVersion": 2,
  "registryRole": "knowledge_center_ingestion",
  "statusSemantics": "publication_candidate_status_not_legal_effect",
  "canonicalDefaultLanguage": "fa",
  "entries": [
    {
      "documentId": "FOUNDATIONAL-INDEX",
      "slug": "foundational",
      "contentClass": "reference",
      "canonicalLanguage": "fa",
      "legalStatus": "under_audit",
      "productStatus": null,
      "authority": "EarthCoop documentation editorial team",
      "version": "0.1.0",
      "reviewedAt": "2026-09-24",
      "renditions": {
        "fa": {
          "source": "fa/foundational/index.mdx",
          "status": "current",
          "sourceVersion": "0.1.0"
        },
        "en": {
          "source": null,
          "status": "not_translated",
          "sourceVersion": null
        },
        "ar": {
          "source": null,
          "status": "not_translated",
          "sourceVersion": null
        }
      },
      "provisions": []
    },
    {
      "documentId": "FC",
      "slug": "foundational/fc",
      "contentClass": "foundational_document",
      "canonicalLanguage": "fa",
      "legalStatus": "effective",
      "productStatus": null,
      "authority": "EarthCoop founder",
      "version": "1.0",
      "reviewedAt": "2026-10-01",
      "renditions": {
        "fa": {
          "source": "releases/foundational/2026-10-01/consolidated/FC-1.0.full.fa.md",
          "status": "current",
          "sourceVersion": "1.0"
        },
        "en": {
          "source": null,
          "status": "not_translated",
          "sourceVersion": null
        },
        "ar": {
          "source": null,
          "status": "not_translated",
          "sourceVersion": null
        }
      },
      "provisions": []
    },
    {
      "documentId": "CH",
      "slug": "foundational/ch",
      "contentClass": "foundational_document",
      "canonicalLanguage": "fa",
      "legalStatus": "effective",
      "productStatus": null,
      "authority": "EarthCoop founder",
      "version": "1.0",
      "reviewedAt": "2026-10-01",
      "renditions": {
        "fa": {
          "source": "releases/foundational/2026-10-01/consolidated/CH-1.0.full.fa.md",
          "status": "current",
          "sourceVersion": "1.0"
        },
        "en": {
          "source": null,
          "status": "not_translated",
          "sourceVersion": null
        },
        "ar": {
          "source": null,
          "status": "not_translated",
          "sourceVersion": null
        }
      },
      "provisions": []
    },
    {
      "documentId": "CO",
      "slug": "foundational/co",
      "contentClass": "foundational_document",
      "canonicalLanguage": "fa",
      "legalStatus": "effective",
      "productStatus": null,
      "authority": "EarthCoop founder",
      "version": "1.0",
      "reviewedAt": "2026-10-01",
      "renditions": {
        "fa": {
          "source": "releases/foundational/2026-10-01/consolidated/CO-1.0.full.fa.md",
          "status": "current",
          "sourceVersion": "1.0"
        },
        "en": {
          "source": null,
          "status": "not_translated",
          "sourceVersion": null
        },
        "ar": {
          "source": null,
          "status": "not_translated",
          "sourceVersion": null
        }
      },
      "provisions": []
    },
    {
      "documentId": "EX",
      "slug": "foundational/ex",
      "contentClass": "foundational_document",
      "canonicalLanguage": "fa",
      "legalStatus": "effective",
      "productStatus": null,
      "authority": "EarthCoop founder",
      "version": "1.0",
      "reviewedAt": "2026-10-01",
      "renditions": {
        "fa": {
          "source": "releases/foundational/2026-10-01/consolidated/EX-1.0.full.fa.md",
          "status": "current",
          "sourceVersion": "1.0"
        },
        "en": {
          "source": null,
          "status": "not_translated",
          "sourceVersion": null
        },
        "ar": {
          "source": null,
          "status": "not_translated",
          "sourceVersion": null
        }
      },
      "provisions": []
    },
    {
      "documentId": "ECON",
      "slug": "foundational/econ",
      "contentClass": "foundational_document",
      "canonicalLanguage": "fa",
      "legalStatus": "effective",
      "productStatus": null,
      "authority": "EarthCoop founder",
      "version": "1.0",
      "reviewedAt": "2026-10-01",
      "renditions": {
        "fa": {
          "source": "releases/foundational/2026-10-01/consolidated/ECON-1.0.full.fa.md",
          "status": "current",
          "sourceVersion": "1.0"
        },
        "en": {
          "source": null,
          "status": "not_translated",
          "sourceVersion": null
        },
        "ar": {
          "source": null,
          "status": "not_translated",
          "sourceVersion": null
        }
      },
      "provisions": []
    },
    {
      "documentId": "ECON-REF-01",
      "slug": "reference/economy/econ-ref-01",
      "contentClass": "reference",
      "canonicalLanguage": "fa",
      "legalStatus": "official_draft",
      "productStatus": null,
      "authority": "EarthCoop founder",
      "version": "1.0",
      "reviewedAt": "2026-10-01",
      "renditions": {
        "fa": {
          "source": "releases/foundational/2026-10-01/consolidated/ECON-REF-01-1.0.full.fa.md",
          "status": "current",
          "sourceVersion": "1.0"
        },
        "en": {
          "source": null,
          "status": "not_translated",
          "sourceVersion": null
        },
        "ar": {
          "source": null,
          "status": "not_translated",
          "sourceVersion": null
        }
      },
      "provisions": []
    },
    {
      "documentId": "DG",
      "slug": "foundational/dg",
      "contentClass": "foundational_document",
      "canonicalLanguage": "fa",
      "legalStatus": "effective",
      "productStatus": null,
      "authority": "EarthCoop founder",
      "version": "1.0",
      "reviewedAt": "2026-10-01",
      "renditions": {
        "fa": {
          "source": "releases/foundational/2026-10-01/consolidated/DG-1.0.full.fa.md",
          "status": "current",
          "sourceVersion": "1.0"
        },
        "en": {
          "source": null,
          "status": "not_translated",
          "sourceVersion": null
        },
        "ar": {
          "source": null,
          "status": "not_translated",
          "sourceVersion": null
        }
      },
      "provisions": []
    },
    {
      "documentId": "JUD",
      "slug": "foundational/jud",
      "contentClass": "foundational_document",
      "canonicalLanguage": "fa",
      "legalStatus": "effective",
      "productStatus": null,
      "authority": "EarthCoop founder",
      "version": "1.0",
      "reviewedAt": "2026-10-01",
      "renditions": {
        "fa": {
          "source": "releases/foundational/2026-10-01/consolidated/JUD-1.0.full.fa.md",
          "status": "current",
          "sourceVersion": "1.0"
        },
        "en": {
          "source": null,
          "status": "not_translated",
          "sourceVersion": null
        },
        "ar": {
          "source": null,
          "status": "not_translated",
          "sourceVersion": null
        }
      },
      "provisions": []
    },
    {
      "documentId": "LOC",
      "slug": "foundational/loc",
      "contentClass": "foundational_document",
      "canonicalLanguage": "fa",
      "legalStatus": "effective",
      "productStatus": null,
      "authority": "EarthCoop founder",
      "version": "1.0",
      "reviewedAt": "2026-10-01",
      "renditions": {
        "fa": {
          "source": "releases/foundational/2026-10-01/consolidated/LOC-1.0.full.fa.md",
          "status": "current",
          "sourceVersion": "1.0"
        },
        "en": {
          "source": null,
          "status": "not_translated",
          "sourceVersion": null
        },
        "ar": {
          "source": null,
          "status": "not_translated",
          "sourceVersion": null
        }
      },
      "provisions": []
    },
    {
      "documentId": "ETH",
      "slug": "foundational/eth",
      "contentClass": "foundational_document",
      "canonicalLanguage": "fa",
      "legalStatus": "effective",
      "productStatus": null,
      "authority": "EarthCoop founder",
      "version": "1.0",
      "reviewedAt": "2026-10-01",
      "renditions": {
        "fa": {
          "source": "releases/foundational/2026-10-01/consolidated/ETH-1.0.full.fa.md",
          "status": "current",
          "sourceVersion": "1.0"
        },
        "en": {
          "source": null,
          "status": "not_translated",
          "sourceVersion": null
        },
        "ar": {
          "source": null,
          "status": "not_translated",
          "sourceVersion": null
        }
      },
      "provisions": []
    },
    {
      "documentId": "STD",
      "slug": "foundational/std",
      "contentClass": "foundational_document",
      "canonicalLanguage": "fa",
      "legalStatus": "effective",
      "productStatus": null,
      "authority": "EarthCoop founder",
      "version": "1.0",
      "reviewedAt": "2026-10-01",
      "renditions": {
        "fa": {
          "source": "releases/foundational/2026-10-01/consolidated/STD-1.0.full.fa.md",
          "status": "current",
          "sourceVersion": "1.0"
        },
        "en": {
          "source": null,
          "status": "not_translated",
          "sourceVersion": null
        },
        "ar": {
          "source": null,
          "status": "not_translated",
          "sourceVersion": null
        }
      },
      "provisions": []
    }
  ]
}
